<?xml version='1.0' encoding="UTF-8" ?>
<!DOCTYPE users SYSTEM "D:\File_System\Personal_Affairs\Java workspace\src\alibaba\inclass\Demo4\dtd\user.dtd">
<users>

    <user id="1">
        <name>张三</name>
        <age>34</age>
        <gender>男</gender>
        <salary>3000</salary>
    </user>
    <user id="2">
        <name>李四</name>
        <age>21</age>
        <gender>女</gender>
        <salary>4000</salary>
    </user>
    <user id="3">
        <name>王五</name>
        <age>46</age>
        <gender>女</gender>
        <salary>6500</salary>
    </user>
    <user id="4">
        <name>赵六</name>
        <age>28</age>
        <gender>男</gender>
        <salary>4400</salary>
    </user>
    <user id="5">
        <name>钱七</name>
        <age>53</age>
        <gender>男</gender>
        <salary>12000</salary>
    </user>
</users>